{
  "format": 2,
  "atlas": {
    "id": "fixture",
    "title": "Fixture Atlas",
    "summary": "Executable Atlas format 2 fixture.",
    "navigation": [
      {
        "title": "Maps",
        "maps": [
          "architecture",
          "operations"
        ]
      }
    ],
    "resources": [
      {
        "id": "authentication-guide",
        "uri": "docs/authentication.md",
        "title": "Authentication guide",
        "summary": "Implementation guidance for the fixture."
      }
    ],
    "content": [],
    "references": [],
    "extensions": {},
    "body": "\n# Fixture Atlas\n\nExecutable Atlas format 2 fixture.\n\nThis Atlas exists to exercise one bounded format and validation behavior.\n\n## Resource: authentication-guide\n\nImplementation guidance for the fixture.\n"
  },
  "maps": [
    {
      "id": "architecture",
      "title": "Architecture",
      "summary": "Context for the architecture fixture Map.",
      "question": "What context belongs in the architecture fixture Map?",
      "status": "active",
      "path": "maps/architecture/map.md",
      "areas": [
        {
          "id": "boundary",
          "title": "Boundary",
          "summary": "Boundary context.",
          "question": "Does this record materially affect boundary?"
        },
        {
          "id": "security",
          "title": "Security",
          "summary": "Security context.",
          "question": "Does this record materially affect security?"
        }
      ],
      "content": [],
      "references": [],
      "extensions": {},
      "body": "\n# Architecture\n\nContext for the architecture fixture Map.\n\nThis Map supplies a durable question and enough substantive context for the fixture.\n\n## Question\n\nWhat context belongs in the architecture fixture Map?\n\n## Area: boundary\n\nBoundary context.\n\n### Question\n\nDoes this record materially affect boundary?\n\n## Area: security\n\nSecurity context.\n\n### Question\n\nDoes this record materially affect security?\n",
      "pointIds": [
        "edge-authentication"
      ],
      "anchorPointIds": [
        "edge-authentication"
      ],
      "contextPointIds": []
    },
    {
      "id": "operations",
      "title": "Operations",
      "summary": "Context for the operations fixture Map.",
      "question": "What context belongs in the operations fixture Map?",
      "status": "active",
      "path": "maps/operations/map.md",
      "areas": [
        {
          "id": "runtime",
          "title": "Runtime",
          "summary": "Runtime context.",
          "question": "Does this record materially affect runtime?"
        },
        {
          "id": "security",
          "title": "Security",
          "summary": "Security context.",
          "question": "Does this record materially affect security?"
        }
      ],
      "content": [],
      "references": [],
      "extensions": {},
      "body": "\n# Operations\n\nContext for the operations fixture Map.\n\nThis Map supplies a durable question and enough substantive context for the fixture.\n\n## Question\n\nWhat context belongs in the operations fixture Map?\n\n## Area: runtime\n\nRuntime context.\n\n### Question\n\nDoes this record materially affect runtime?\n\n## Area: security\n\nSecurity context.\n\n### Question\n\nDoes this record materially affect security?\n",
      "pointIds": [
        "edge-authentication",
        "rotate-edge-keys"
      ],
      "anchorPointIds": [
        "rotate-edge-keys"
      ],
      "contextPointIds": [
        "edge-authentication"
      ]
    }
  ],
  "points": [
    {
      "id": "edge-authentication",
      "title": "Authenticate at the edge",
      "summary": "Canonical context for authenticate at the edge.",
      "kinds": [
        "decision"
      ],
      "posture": "asserted",
      "lifecycle": "active",
      "primaryMap": "architecture",
      "anchorPath": "maps/architecture/points/edge-authentication.md",
      "records": [
        {
          "kind": "anchor",
          "map": "architecture",
          "path": "maps/architecture/points/edge-authentication.md",
          "title": "Authenticate at the edge",
          "summary": "Canonical context for authenticate at the edge.",
          "areas": [
            {
              "id": "architecture-edge-authentication-area-boundary",
              "area": "boundary",
              "context": "This record affects Boundary because canonical context for authenticate at the edge."
            },
            {
              "id": "architecture-edge-authentication-area-security",
              "area": "security",
              "context": "This record affects Security because canonical context for authenticate at the edge."
            }
          ],
          "content": [
            {
              "resource": "authentication-guide",
              "id": "architecture-edge-authentication-content-authentication-guide"
            }
          ],
          "references": [
            {
              "uri": "https://example.com/security-model",
              "id": "architecture-edge-authentication-reference-uri",
              "role": "evidence"
            }
          ],
          "extensions": {},
          "body": "\n# Authenticate at the edge\n\nCanonical context for authenticate at the edge.\n\nThis anchor record states a substantive project decision in its own right. It explains the governing boundary, the reason that the boundary exists, and the consequences that readers and software agents must preserve when they change related documents or implementation. The body is intentionally long enough to satisfy the deterministic anchor substance rule without relying on headings or link destinations.\n\n## Connection: architecture-edge-authentication-area-boundary\n\nThis record affects Boundary because canonical context for authenticate at the edge.\n\n## Connection: architecture-edge-authentication-area-security\n\nThis record affects Security because canonical context for authenticate at the edge.\n\n## Connection: architecture-edge-authentication-supports-rotate-edge-keys\n\nThe boundary requires an operational key rotation practice.\n"
        },
        {
          "kind": "context",
          "map": "operations",
          "path": "maps/operations/points/edge-authentication.md",
          "title": "Operational context",
          "summary": "Map-local context for edge-authentication.",
          "areas": [
            {
              "id": "operations-edge-authentication-area-runtime",
              "area": "runtime",
              "context": "This record affects Runtime because map-local context for edge-authentication."
            },
            {
              "id": "operations-edge-authentication-area-security",
              "area": "security",
              "context": "This record affects Security because map-local context for edge-authentication."
            }
          ],
          "content": [
            {
              "resource": "authentication-guide",
              "id": "operations-edge-authentication-content-authentication-guide"
            }
          ],
          "references": [],
          "extensions": {},
          "body": "\n# Operational context\n\nMap-local context for edge-authentication.\n\nOperations contributes the runtime consequences of the edge-authentication decision. Key material must rotate without removing the boundary, monitoring must distinguish rejected credentials from service failures, and incident procedures must preserve the canonical architecture decision.\n\n## Connection: operations-edge-authentication-area-runtime\n\nThis record affects Runtime because map-local context for edge-authentication.\n\n## Connection: operations-edge-authentication-area-security\n\nThis record affects Security because map-local context for edge-authentication.\n"
        }
      ],
      "relations": [
        {
          "id": "architecture-edge-authentication-supports-rotate-edge-keys",
          "sourcePoint": "edge-authentication",
          "sourceMap": "architecture",
          "sourcePath": "maps/architecture/points/edge-authentication.md",
          "type": "supports",
          "targetPoint": "rotate-edge-keys",
          "note": "The boundary requires an operational key rotation practice.",
          "extensions": {
            "x-origin": "architecture-review"
          }
        }
      ],
      "incomingRelations": [
        {
          "id": "operations-rotate-edge-keys-depends-on-edge-authentication",
          "sourcePoint": "rotate-edge-keys",
          "sourceMap": "operations",
          "sourcePath": "maps/operations/points/rotate-edge-keys.md",
          "type": "depends-on",
          "targetPoint": "edge-authentication",
          "note": "Rotation exists to preserve the edge boundary.",
          "extensions": {}
        }
      ],
      "review": null,
      "extensions": {}
    },
    {
      "id": "rotate-edge-keys",
      "title": "Rotate edge keys",
      "summary": "Canonical context for rotate edge keys.",
      "kinds": [
        "decision"
      ],
      "posture": "asserted",
      "lifecycle": "active",
      "primaryMap": "operations",
      "anchorPath": "maps/operations/points/rotate-edge-keys.md",
      "records": [
        {
          "kind": "anchor",
          "map": "operations",
          "path": "maps/operations/points/rotate-edge-keys.md",
          "title": "Rotate edge keys",
          "summary": "Canonical context for rotate edge keys.",
          "areas": [
            {
              "id": "operations-rotate-edge-keys-area-runtime",
              "area": "runtime",
              "context": "This record affects Runtime because canonical context for rotate edge keys."
            },
            {
              "id": "operations-rotate-edge-keys-area-security",
              "area": "security",
              "context": "This record affects Security because canonical context for rotate edge keys."
            }